{
  "schema_version": 1,
  "registry": {
    "name": "wp-gym-run-registry",
    "issue": "https://github.com/Automattic/wp-gym/issues/136",
    "created_at": "2026-05-28T00:00:00Z"
  },
  "run": {
    "id": "fixture-run-2026-05-28-openai-gpt-5-5-valid-semantic-blocks",
    "actor": "wordpress-task-runner",
    "attempt": 1,
    "started_at": "2026-05-28T00:00:00Z",
    "completed_at": "2026-05-28T00:01:00Z",
    "outcome": "passed"
  },
  "task_set": {
    "id": "benchmark-readiness-pilot",
    "version": "fixture-2026-05-28",
    "sha256": "7412d37c6da811230da5579c58949c94c8ec7a4a5218ca9f02b0f51f67648e59",
    "source_path": "task-sets/benchmark-readiness-pilot.json",
    "benchmark_status": "pilot",
    "headline_score_eligible": false,
    "compatibility_group": "benchmark-readiness-pilot.fixture-2026-05-28"
  },
  "scenario": {
    "id": "block-markup-valid-semantic-blocks",
    "version": "fixture-2026-05-28",
    "sha256": "8b9ece1f8e35f9a545bf8e526b9133e6d68f5c9d92087481635efcdceb480f1c",
    "source_path": "scenarios/block-markup/valid-semantic-blocks.json",
    "prompt_sha256": "cccccccccccccccccccccccccccccccccccccccccccccccccccccccccccccccc",
    "task_family": "block-markup"
  },
  "runner": {
    "provider": "openai",
    "model": "gpt-5.5",
    "agent_slug": "wordpress-task-runner",
    "workflow_run_url": "https://github.com/Automattic/wp-gym/actions/runs/123",
    "job_id": "benchmark"
  },
  "runtime": {
    "id": "wp-codebox",
    "environment_id": "fixture",
    "artifact_bundle_id": "wp-gym-direct-fixture"
  },
  "grade_identity": {
    "grader_sha256": "9cb263f816f9089522b69c31f6a41fa88957c1b4aff6c6526b1a1c96f2cd7b2e",
    "result_sha256": "7250bc590604f8a6d2760f2907f4c72309ffc6b4e619014805ea8048b0b021ec",
    "success": true,
    "reward": 1,
    "failure_class": "none"
  },
  "calibration": {
    "row_type": "frontier_model",
    "included": true,
    "status": "pilot",
    "result_set_id": "block-markup-valid-semantic-blocks-local-fixture-baseline"
  },
  "benchmark": {
    "eligible": false,
    "headline_score_eligible": false,
    "compatibility_group": "benchmark-readiness-pilot.fixture-2026-05-28",
    "exclusion_reasons": ["pilot_task_set"]
  },
  "eval_artifact": {
    "kind": "json",
    "path_or_url": "fixtures/eval-artifacts/direct-wp-gym-row.json",
    "sha256": "7250bc590604f8a6d2760f2907f4c72309ffc6b4e619014805ea8048b0b021ec",
    "media_type": "application/json"
  },
  "artifact_index": {
    "schema_version": 1,
    "index_id": "fixture-run-2026-05-28-openai-gpt-5-5-valid-semantic-blocks/index",
    "created_at": "2026-05-28T00:01:00Z",
    "entries": [
      {
        "name": "eval_artifact",
        "category": "eval_artifact",
        "kind": "json",
        "path_or_url": "fixtures/eval-artifacts/direct-wp-gym-row.json",
        "sha256": "7250bc590604f8a6d2760f2907f4c72309ffc6b4e619014805ea8048b0b021ec",
        "media_type": "application/json",
        "required": true
      },
      {
        "name": "grade_artifact",
        "category": "grade",
        "kind": "json",
        "path_or_url": "fixtures/eval-artifacts/direct-wp-gym-row.json",
        "sha256": "7250bc590604f8a6d2760f2907f4c72309ffc6b4e619014805ea8048b0b021ec",
        "media_type": "application/json",
        "required": true
      },
      {
        "name": "replay_bundle",
        "category": "replay",
        "kind": "zip",
        "path_or_url": "fixtures/replay-regrade/replay.zip",
        "sha256": "da2a5bf59c092dc2dfed37eee734b5ee9c42dffefa45a16fa14a3926683955d0",
        "media_type": "application/zip",
        "required": true
      }
    ]
  }
}
